<xs:schema attributeFormDefault="unqualified" elementFormDefault="qualified" xmlns:xs="http://www.w3.org/2001/XMLSchema">
    <xs:element name="FileStruct">
        <xs:complexType>
            <xs:sequence>
                <xs:element name="Dir">
                    <xs:complexType mixed="true">
                        <xs:sequence>
                            <xs:element type="xs:string" name="File" maxOccurs="unbounded" minOccurs="0"/>
                            <xs:element name="Dir" maxOccurs="unbounded" minOccurs="0">
                                <xs:complexType mixed="true">
                                    <xs:sequence>
                                        <xs:element type="xs:string" name="File" maxOccurs="unbounded" minOccurs="0"/>
                                        <xs:element name="Dir" minOccurs="0">
                                            <xs:complexType>
                                                <xs:sequence>
                                                    <xs:element type="xs:string" name="File" maxOccurs="unbounded" minOccurs="0"/>
                                                    <xs:element name="Dir" maxOccurs="unbounded" minOccurs="0">
                                                        <xs:complexType mixed="true">
                                                            <xs:sequence>
                                                                <xs:element name="Dir" maxOccurs="unbounded" minOccurs="0">
                                                                    <xs:complexType mixed="true">
                                                                        <xs:sequence>
                                                                            <xs:element name="Dir" minOccurs="0">
                                                                                <xs:complexType>
                                                                                    <xs:sequence>
                                                                                        <xs:element type="xs:string" name="File" maxOccurs="unbounded" minOccurs="0"/>
                                                                                    </xs:sequence>
                                                                                    <xs:attribute type="xs:string" name="name"/>
                                                                                </xs:complexType>
                                                                            </xs:element>
                                                                        </xs:sequence>
                                                                        <xs:attribute type="xs:string" name="name" use="optional"/>
                                                                    </xs:complexType>
                                                                </xs:element>
                                                            </xs:sequence>
                                                            <xs:attribute type="xs:string" name="name" use="optional"/>
                                                        </xs:complexType>
                                                    </xs:element>
                                                </xs:sequence>
                                                <xs:attribute type="xs:string" name="name"/>
                                            </xs:complexType>
                                        </xs:element>
                                    </xs:sequence>
                                    <xs:attribute type="xs:string" name="name" use="optional"/>
                                </xs:complexType>
                            </xs:element>
                        </xs:sequence>
                        <xs:attribute type="xs:string" name="name"/>
                    </xs:complexType>
                </xs:element>
            </xs:sequence>
        </xs:complexType>
    </xs:element>
</xs:schema>